{
  "$schema": "https://json-schema.org/draft/2020-12/schema",
  "$id": "land-grid.schema.json",
  "title": "Land grid",
  "description": "Where the water is on the campaign map, as the painted map shows it: a coarse grid of samples (landmask.py's own, 25 m) classified water or land. Generated by tools/location-sync/export_land_grid.py; never hand-edited. Read by module/blank-inheritance/scripts/core/land-grid.mjs, which the Location Editor's journey checks use to tell a walk across open water from a walk along a street. design/location-editor.md section 16.",
  "type": "object",
  "required": ["kind", "version", "cols", "rows", "step", "origin", "runs"],
  "additionalProperties": false,
  "properties": {
    "$schema": { "type": "string" },
    "kind": { "const": "land-grid" },
    "version": { "const": 1 },
    "cols": { "type": "integer", "minimum": 1 },
    "rows": { "type": "integer", "minimum": 1 },
    "step": { "type": "integer", "minimum": 1, "description": "Image pixels (metres) per sample." },
    "origin": {
      "type": "array",
      "description": "The centre of sample (0, 0) in master-image pixels.",
      "items": { "type": "number" },
      "minItems": 2,
      "maxItems": 2
    },
    "runs": {
      "type": "array",
      "description": "Run-length encoded samples in row-major order: [value, length], value 1 for water and 0 for land. The lengths sum to cols x rows.",
      "items": {
        "type": "array",
        "prefixItems": [{ "enum": [0, 1] }, { "type": "integer", "minimum": 1 }],
        "items": false,
        "minItems": 2,
        "maxItems": 2
      }
    }
  }
}
