{"$schema":"../schema/land-grid.schema.json","kind":"land-grid","version":1,"cols":480,"rows":480,"step":25,"origin":[212.5,212.5],"runs":[[0,388],[1,2],[0,36],[1,54],[0,388],[1,2],[0,35],[1,55],[0,387],[1,2],[0,34],[1,57],[0,386],[1,2],[0,34],[1,58],[0,386],[1,2],[0,33],[1,59],[0,385],[1,2],[0,32],[1,61],[0,384],[1,2],[0,32],[1,62],[0,383],[1,2],[0,32],[1,63],[0,383],[1,2],[0,31],[1,64],[0,373],[1,1],[0,8],[1,3],[0,29],[1,66],[0,381],[1,3],[0,29],[1,67],[0,380],[1,3],[0,1],[1,2],[0,26],[1,68],[0,374],[1,3],[0,3],[1,1],[0,2],[1,4],[0,24],[1,69],[0,374],[1,6],[0,1],[1,7],[0,21],[1,71],[0,373],[1,6],[0,1],[1,8],[0,20],[1,72],[0,369],[1,8],[0,1],[1,11],[0,18],[1,73],[0,360],[1,1],[0,5],[1,6],[0,5],[1,13],[0,16],[1,74],[0,360],[1,1],[0,2],[1,6],[0,8],[1,14],[0,13],[1,76],[0,362],[1,4],[0,11],[1,14],[0,12],[1,77],[0,378],[1,14],[0,10],[1,78],[0,356],[1,1],[0,22],[1,14],[0,7],[1,80],[0,353],[1,3],[0,24],[1,14],[0,5],[1,81],[0,350],[1,3],[0,28],[1,14],[0,3],[1,82],[0,349],[1,2],[0,30],[1,99],[0,346],[1,2],[0,34],[1,98],[0,344],[1,2],[0,37],[1,97],[0,342],[1,1],[0,41],[1,96],[0,336],[1,1],[0,3],[1,2],[0,42],[1,96],[0,338],[1,2],[0,45],[1,95],[0,386],[1,94],[0,386],[1,94],[0,386],[1,94],[0,385],[1,95],[0,383],[1,97],[0,382],[1,98],[0,381],[1,99],[0,380],[1,100],[0,378],[1,102],[0,377],[1,103],[0,376],[1,104],[0,375],[1,105],[0,314],[1,1],[0,58],[1,107],[0,372],[1,108],[0,371],[1,109],[0,369],[1,111],[0,368],[1,112],[0,367],[1,113],[0,366],[1,114],[0,364],[1,116],[0,363],[1,117],[0,362],[1,118],[0,361],[1,119],[0,360],[1,120],[0,362],[1,118],[0,357],[1,1],[0,2],[1,120],[0,356],[1,2],[0,2],[1,120],[0,356],[1,2],[0,2],[1,120],[0,353],[1,1],[0,3],[1,123],[0,352],[1,4],[0,2],[1,122],[0,353],[1,127],[0,347],[1,2],[0,1],[1,1],[0,3],[1,126],[0,346],[1,4],[0,3],[1,127],[0,347],[1,22],[0,5],[1,106],[0,238],[1,1],[0,104],[1,1],[0,4],[1,20],[0,7],[1,105],[0,343],[1,2],[0,4],[1,19],[0,8],[1,104],[0,241],[1,1],[0,98],[1,2],[0,1],[1,3],[0,3],[1,18],[0,9],[1,104],[0,24],[1,3],[0,1],[1,1],[0,311],[1,3],[0,1],[1,3],[0,3],[1,16],[0,10],[1,104],[0,24],[1,4],[0,312],[1,8],[0,3],[1,14],[0,12],[1,103],[0,26],[1,1],[0,36],[1,1],[0,275],[1,9],[0,4],[1,3],[0,3],[1,5],[0,15],[1,102],[0,64],[1,1],[0,273],[1,11],[0,10],[1,3],[0,17],[1,101],[0,64],[1,1],[0,273],[1,12],[0,10],[1,1],[0,19],[1,100],[0,64],[1,2],[0,183],[1,1],[0,85],[1,1],[0,2],[1,13],[0,30],[1,99],[0,334],[1,2],[0,3],[1,11],[0,33],[1,97],[0,332],[1,5],[0,2],[1,10],[0,35],[1,96],[0,331],[1,18],[0,35],[1,96],[0,330],[1,1],[0,1],[1,17],[0,35],[1,96],[0,333],[1,16],[0,32],[1,99],[0,333],[1,17],[0,29],[1,101],[0,259],[1,1],[0,66],[1,4],[0,2],[1,19],[0,26],[1,103],[0,261],[1,1],[0,63],[1,24],[0,27],[1,104],[0,323],[1,23],[0,28],[1,106],[0,322],[1,24],[0,27],[1,28],[0,1],[1,78],[0,322],[1,24],[0,26],[1,29],[0,1],[1,78],[0,266],[1,1],[0,53],[1,27],[0,23],[1,110],[0,267],[1,1],[0,49],[1,31],[0,21],[1,111],[0,305],[1,45],[0,18],[1,112],[0,297],[1,53],[0,17],[1,113],[0,296],[1,55],[0,14],[1,115],[0,295],[1,57],[0,12],[1,116],[0,293],[1,60],[0,10],[1,117],[0,221],[1,1],[0,70],[1,61],[0,9],[1,118],[0,276],[1,1],[0,13],[1,63],[0,9],[1,118],[0,278],[1,3],[0,8],[1,64],[0,8],[1,119],[0,279],[1,2],[0,7],[1,66],[0,7],[1,119],[0,280],[1,2],[0,5],[1,68],[0,2],[1,123],[0,281],[1,2],[0,3],[1,194],[0,282],[1,1],[0,2],[1,195],[0,283],[1,1],[0,1],[1,195],[0,282],[1,1],[0,2],[1,195],[0,280],[1,4],[0,1],[1,195],[0,279],[1,5],[0,1],[1,195],[0,278],[1,6],[0,2],[1,194],[0,277],[1,7],[0,1],[1,195],[0,276],[1,8],[0,2],[1,194],[0,274],[1,10],[0,3],[1,193],[0,273],[1,12],[0,1],[1,194],[0,272],[1,13],[0,5],[1,190],[0,271],[1,13],[0,8],[1,188],[0,249],[1,1],[0,19],[1,13],[0,11],[1,187],[0,268],[1,12],[0,15],[1,185],[0,26],[1,1],[0,240],[1,11],[0,19],[1,183],[0,26],[1,1],[0,225],[1,1],[0,13],[1,10],[0,22],[1,182],[0,21],[1,2],[0,2],[1,1],[0,225],[1,3],[0,10],[1,11],[0,25],[1,180],[0,21],[1,4],[0,225],[1,5],[0,9],[1,9],[0,29],[1,178],[0,22],[1,4],[0,59],[1,1],[0,164],[1,5],[0,10],[1,6],[0,32],[1,177],[0,86],[1,1],[0,164],[1,5],[0,10],[1,3],[0,36],[1,175],[0,27],[1,1],[0,224],[1,5],[0,9],[1,1],[0,39],[1,174],[0,253],[1,5],[0,50],[1,172],[0,254],[1,4],[0,52],[1,170],[0,255],[1,4],[0,52],[1,169],[0,255],[1,5],[0,51],[1,169],[0,254],[1,6],[0,50],[1,170],[0,253],[1,6],[0,51],[1,170],[0,252],[1,6],[0,49],[1,173],[0,250],[1,7],[0,48],[1,175],[0,94],[1,1],[0,154],[1,7],[0,48],[1,176],[0,248],[1,7],[0,48],[1,177],[0,53],[1,1],[0,193],[1,7],[0,47],[1,179],[0,246],[1,7],[0,47],[1,180],[0,244],[1,8],[0,47],[1,181],[0,241],[1,10],[0,47],[1,182],[0,47],[1,4],[0,189],[1,10],[0,46],[1,184],[0,47],[1,4],[0,188],[1,10],[0,46],[1,185],[0,47],[1,5],[0,186],[1,10],[0,46],[1,186],[0,47],[1,6],[0,185],[1,10],[0,45],[1,187],[0,48],[1,5],[0,48],[1,1],[0,135],[1,10],[0,44],[1,189],[0,237],[1,9],[0,44],[1,190],[0,236],[1,9],[0,44],[1,191],[0,236],[1,8],[0,43],[1,193],[0,114],[1,3],[0,1],[1,1],[0,117],[1,7],[0,43],[1,194],[0,111],[1,7],[0,15],[1,1],[0,101],[1,7],[0,43],[1,195],[0,111],[1,7],[0,3],[1,1],[0,113],[1,6],[0,43],[1,196],[0,106],[1,1],[0,3],[1,8],[0,15],[1,1],[0,100],[1,6],[0,42],[1,198],[0,101],[1,7],[0,1],[1,9],[0,116],[1,6],[0,41],[1,199],[0,107],[1,8],[0,22],[1,1],[0,95],[1,7],[0,40],[1,200],[0,107],[1,6],[0,25],[1,1],[0,7],[1,1],[0,86],[1,7],[0,39],[1,201],[0,107],[1,5],[0,120],[1,8],[0,37],[1,203],[0,108],[1,3],[0,121],[1,8],[0,36],[1,204],[0,109],[1,2],[0,120],[1,8],[0,6],[1,4],[0,26],[1,205],[0,108],[1,1],[0,104],[1,1],[0,17],[1,8],[0,5],[1,10],[0,19],[1,207],[0,150],[1,1],[0,63],[1,1],[0,16],[1,8],[0,5],[1,15],[0,13],[1,208],[0,230],[1,8],[0,5],[1,21],[0,7],[1,209],[0,230],[1,8],[0,5],[1,26],[0,1],[1,210],[0,230],[1,8],[0,4],[1,238],[0,157],[1,1],[0,71],[1,9],[0,4],[1,238],[0,158],[1,1],[0,70],[1,9],[0,3],[1,239],[0,160],[1,1],[0,68],[1,9],[0,2],[1,240],[0,229],[1,8],[0,3],[1,240],[0,229],[1,8],[0,2],[1,241],[0,228],[1,8],[0,3],[1,241],[0,220],[1,1],[0,7],[1,8],[0,2],[1,242],[0,220],[1,4],[0,4],[1,6],[0,4],[1,3],[0,1],[1,79],[0,1],[1,79],[0,1],[1,78],[0,219],[1,14],[0,5],[1,83],[0,1],[1,79],[0,1],[1,78],[0,219],[1,14],[0,5],[1,242],[0,73],[1,1],[0,99],[1,1],[0,44],[1,14],[0,6],[1,242],[0,73],[1,1],[0,144],[1,13],[0,7],[1,242],[0,218],[1,9],[0,14],[1,239],[0,217],[1,6],[0,23],[1,234],[0,217],[1,5],[0,29],[1,229],[0,216],[1,6],[0,33],[1,225],[0,216],[1,5],[0,34],[1,225],[0,215],[1,6],[0,33],[1,226],[0,215],[1,5],[0,34],[1,226],[0,6],[1,1],[0,208],[1,5],[0,33],[1,227],[0,6],[1,2],[0,206],[1,5],[0,34],[1,227],[0,7],[1,1],[0,206],[1,5],[0,33],[1,228],[0,214],[1,4],[0,34],[1,228],[0,213],[1,5],[0,33],[1,229],[0,213],[1,4],[0,34],[1,229],[0,197],[1,1],[0,14],[1,5],[0,33],[1,230],[0,212],[1,4],[0,34],[1,230],[0,175],[1,1],[0,35],[1,5],[0,33],[1,231],[0,211],[1,4],[0,34],[1,231],[0,204],[1,1],[0,5],[1,5],[0,33],[1,232],[0,194],[1,1],[0,14],[1,6],[0,33],[1,232],[0,194],[1,1],[0,12],[1,7],[0,33],[1,233],[0,208],[1,6],[0,33],[1,233],[0,209],[1,4],[0,33],[1,234],[0,210],[1,1],[0,35],[1,234],[0,211],[1,1],[0,33],[1,235],[0,245],[1,235],[0,244],[1,236],[0,244],[1,236],[0,243],[1,38],[0,3],[1,196],[0,243],[1,32],[0,5],[1,1],[0,4],[1,1],[0,1],[1,193],[0,242],[1,32],[0,15],[1,191],[0,242],[1,31],[0,17],[1,190],[0,242],[1,30],[0,20],[1,188],[0,243],[1,28],[0,27],[1,182],[0,240],[1,2],[0,2],[1,26],[0,32],[1,178],[0,240],[1,2],[0,2],[1,24],[0,36],[1,176],[0,178],[1,1],[0,60],[1,4],[0,2],[1,22],[0,38],[1,175],[0,178],[1,2],[0,59],[1,5],[0,1],[1,21],[0,40],[1,174],[0,155],[1,1],[0,22],[1,1],[0,59],[1,6],[0,2],[1,19],[0,40],[1,175],[0,238],[1,7],[0,2],[1,17],[0,40],[1,176],[0,237],[1,8],[0,2],[1,16],[0,40],[1,14],[0,6],[1,157],[0,237],[1,9],[0,2],[1,13],[0,41],[1,14],[0,19],[1,145],[0,236],[1,11],[0,1],[1,12],[0,41],[1,15],[0,20],[1,144],[0,217],[1,1],[0,18],[1,11],[0,3],[1,9],[0,42],[1,14],[0,20],[1,145],[0,217],[1,6],[0,12],[1,13],[0,2],[1,8],[0,42],[1,14],[0,21],[1,145],[0,216],[1,12],[0,7],[1,13],[0,2],[1,4],[0,45],[1,14],[0,22],[1,145],[0,216],[1,33],[0,2],[1,2],[0,45],[1,14],[0,22],[1,146],[0,149],[1,1],[0,66],[1,35],[0,46],[1,15],[0,20],[1,148],[0,184],[1,1],[0,33],[1,32],[0,47],[1,14],[0,20],[1,14],[0,1],[1,134],[0,220],[1,30],[0,46],[1,14],[0,20],[1,14],[0,3],[1,133],[0,215],[1,3],[0,4],[1,28],[0,45],[1,14],[0,20],[1,15],[0,4],[1,132],[0,195],[1,1],[0,20],[1,4],[0,3],[1,27],[0,44],[1,14],[0,20],[1,15],[0,8],[1,129],[0,215],[1,34],[0,44],[1,14],[0,21],[1,14],[0,9],[1,129],[0,215],[1,35],[0,43],[1,14],[0,20],[1,14],[0,11],[1,128],[0,215],[1,35],[0,42],[1,14],[0,20],[1,14],[0,13],[1,127],[0,216],[1,35],[0,40],[1,14],[0,20],[1,14],[0,15],[1,126],[0,217],[1,35],[0,38],[1,14],[0,20],[1,2],[0,1],[1,12],[0,17],[1,124],[0,218],[1,35],[0,36],[1,14],[0,21],[1,2],[0,1],[1,11],[0,19],[1,123],[0,219],[1,35],[0,35],[1,14],[0,20],[1,2],[0,2],[1,10],[0,22],[1,121],[0,220],[1,35],[0,33],[1,14],[0,24],[1,10],[0,24],[1,120],[0,188],[1,1],[0,32],[1,34],[0,32],[1,14],[0,20],[1,1],[0,1],[1,2],[0,1],[1,9],[0,27],[1,118],[0,187],[1,1],[0,34],[1,33],[0,31],[1,14],[0,20],[1,14],[0,29],[1,117],[0,223],[1,32],[0,30],[1,14],[0,21],[1,14],[0,31],[1,115],[0,224],[1,30],[0,30],[1,15],[0,23],[1,11],[0,34],[1,113],[0,216],[1,1],[0,8],[1,29],[0,30],[1,14],[0,20],[1,2],[0,2],[1,10],[0,37],[1,111],[0,215],[1,3],[0,8],[1,27],[0,31],[1,13],[0,22],[1,12],[0,38],[1,111],[0,214],[1,5],[0,8],[1,26],[0,33],[1,10],[0,23],[1,11],[0,39],[1,111],[0,213],[1,7],[0,8],[1,5],[0,2],[1,15],[0,37],[1,8],[0,27],[1,8],[0,39],[1,111],[0,212],[1,9],[0,8],[1,3],[0,5],[1,13],[0,39],[1,6],[0,21],[1,3],[0,2],[1,8],[0,37],[1,114],[0,213],[1,9],[0,8],[1,1],[0,7],[1,12],[0,40],[1,4],[0,23],[1,3],[0,1],[1,7],[0,37],[1,115],[0,185],[1,2],[0,17],[1,4],[0,6],[1,9],[0,15],[1,12],[0,42],[1,1],[0,20],[1,2],[0,2],[1,10],[0,37],[1,116],[0,183],[1,4],[0,16],[1,5],[0,6],[1,10],[0,14],[1,12],[0,64],[1,12],[0,37],[1,117],[0,181],[1,5],[0,4],[1,1],[0,12],[1,6],[0,6],[1,10],[0,13],[1,11],[0,62],[1,15],[0,37],[1,117],[0,179],[1,5],[0,19],[1,7],[0,8],[1,8],[0,12],[1,11],[0,62],[1,14],[0,37],[1,118],[0,178],[1,5],[0,21],[1,7],[0,8],[1,8],[0,9],[1,12],[0,62],[1,14],[0,37],[1,119],[0,178],[1,3],[0,4],[1,1],[0,12],[1,1],[0,6],[1,7]